<?xml version="1.0" encoding="UTF-8"?>
<!DOCTYPE BGChess SYSTEM "../../BGChess.dtd" >
<BGChess paginate="yes" >

	<BGChessCategory Prefix="1" >
		<BGChessCategoryName>Ангел</BGChessCategoryName>
		<BGChessCategoryBlock />
		<BGChessCategoryBlock />
	</BGChessCategory>

	<BGChessCategory Prefix="3" >
		<BGChessCategoryName>Всадник</BGChessCategoryName>
		<BGChessCategoryBlock />
		<BGChessCategoryBlock />
	</BGChessCategory>

	<BGChessCategory Prefix="8" >
		<BGChessCategoryName>Грифон</BGChessCategoryName>
		<BGChessCategoryBlock />
		<BGChessCategoryBlock />
	</BGChessCategory>

	<BGChessCategory Prefix="4" >
		<BGChessCategoryName>Лев</BGChessCategoryName>
		<BGChessCategoryBlock />
		<BGChessCategoryBlock />
		<BGChessCategoryBlock />
		<BGChessCategoryBlock />
		<BGChessCategoryBlock />
	</BGChessCategory>

</BGChess>
