<?xml version="1.0" encoding="UTF-8"?>
<!DOCTYPE BGChess SYSTEM "../../BGChess.dtd" >
<BGChess paginate="yes" >

	<BGChessCategory Prefix="4" >
		<BGChessCategoryName>Лев</BGChessCategoryName>
		<BGChessCategoryBlock />
		<BGChessCategoryBlock />
	</BGChessCategory>

	<BGChessCategory Prefix="7" >
		<BGChessCategoryName>Сфинкс</BGChessCategoryName>
		<BGChessCategoryBlock />
		<BGChessCategoryBlock />
	</BGChessCategory>

	<BGChessCategory Prefix="8" >
		<BGChessCategoryName>Грифон</BGChessCategoryName>
		<BGChessCategoryBlock />
		<BGChessCategoryBlock />
	</BGChessCategory>

</BGChess>
